{"base_files":[{"bytes":748,"path":"index.rst","sha256":"fc1fa4627b1ce1c3a569311a7fcaf51fa36c05f4fd672f94f37a6689e05b9889"}],"bindings":{"artifact_profile":"01384aaad3bcb3b5f43eb0c5fd72e8ed334271eae52b4da1596c9b8160964dba","plan":"c57c689d52cbb7adc37b265c1e6d29c378a9e3c998c3e67764399c5d9cb40dbd","request":"dbcd516c7e58076e30b2b2bd0ff6a6e1ea0bcb79de9ff681ebdfa820cfe0e03e","snapshot":"08c6be17e75a78a222149f19673f3e4a29c77876d0fbe3ec86e0fbfb5dd41d0d","trace_profile":null,"workflow_package":"22b8ff2654ef362cdcfe29bf80939c540a3a076295107501ea8efe8c62938ab4"},"candidate_identity":"0f6c2a2e4efa497200d074ffc3abf59ceefe72ab96242f0a1f1451766baeac4e","capabilities":{"acceptance":"not_evaluated","engineering_readiness":"not_evaluated","evidence":"not_evaluated","execution":"not_evaluated","registration":"not_evaluated","release":"not_evaluated"},"digest":"0529d704dcfec227b78db28e509f8387141b03f93ce56414167189fce4175266","edit_results":[{"changed_spans":[{"end":414,"start":362}],"findings":[],"id":"edit-content-1","kind":"set_content","origins":[{"decision_ref":"fixture-review-004","kind":"reviewed_project_configuration","pointer":"/edits/0","rationale":"Explicit fixture edit.","source_ref":{"fixture":"tests/artifact_support.py"}}],"post_digest":"b61e1d2551795acc10fce2d6b5d4916e995f2716f38cd537618348abc836e3aa","pre_digest":"fc1fa4627b1ce1c3a569311a7fcaf51fa36c05f4fd672f94f37a6689e05b9889","target_native_id":"COMP_REQ_001","target_path":"index.rst","unchanged_complement":"byte_exact"}],"index":{"capabilities":{"acceptance":"not_evaluated","engineering_readiness":"not_evaluated","evidence":"not_evaluated","execution":"not_evaluated","registration":"not_evaluated","release":"not_evaluated"},"counts":{"files":1,"findings":0,"needs":3,"relations":5,"wrappers":1},"digest":"195bd0820e6484a2ba6c387b45bfdb20563fa7e06eb308bb1e9662cd4e69f803","files":[{"bytes":726,"directives":[{"content":"   Manual wrapper prose that must remain byte exact.\n\n","content_start_byte":150,"end_byte":204,"end_line":10,"indent":0,"name":"document","native_id":"DOC_COMPONENT_001","native_version":"1","option_values":{"id":"DOC_COMPONENT_001","realizes":"WP_COMPONENT_001","status":"draft"},"options":[{"end_byte":100,"line":5,"name":"id","raw":"   :id: DOC_COMPONENT_001\n","start_byte":74,"value":"DOC_COMPONENT_001"},{"end_byte":118,"line":6,"name":"status","raw":"   :status: draft\n","start_byte":100,"value":"draft"},{"end_byte":149,"line":7,"name":"realizes","raw":"   :realizes: WP_COMPONENT_001\n","start_byte":118,"value":"WP_COMPONENT_001"}],"original_digest":"0342f0339fbc81e24be6d4a35f2ab0aa9f6e7f0ab91c727db2814ff8ff1d1f2a","path":"index.rst","start_byte":37,"start_line":4,"title":"Component work product"},{"content":"   Updated explicit content.\n","content_start_byte":363,"end_byte":392,"end_line":19,"indent":0,"name":"comp_req","native_id":"COMP_REQ_001","native_version":"1","option_values":{"derived_from":"FEAT_REQ_001","fully_verifies":"TEST_CASE_001","id":"COMP_REQ_001","status":"valid","version":"1"},"options":[{"end_byte":263,"line":12,"name":"id","raw":"   :id: COMP_REQ_001\n","start_byte":242,"value":"COMP_REQ_001"},{"end_byte":281,"line":13,"name":"status","raw":"   :status: valid\n","start_byte":263,"value":"valid"},{"end_byte":296,"line":14,"name":"version","raw":"   :version: 1\n","start_byte":281,"value":"1"},{"end_byte":327,"line":15,"name":"derived_from","raw":"   :derived_from: FEAT_REQ_001\n","start_byte":296,"value":"FEAT_REQ_001"},{"end_byte":361,"line":16,"name":"fully_verifies","raw":"   :fully_verifies: TEST_CASE_001\n","start_byte":327,"value":"TEST_CASE_001"}],"original_digest":"cc3a8d21aa7f94b3216ee01a7592cb289004b409ad2b4f5474ef3aa9c492927f","path":"index.rst","start_byte":204,"start_line":11,"title":"Deterministic component"},{"content":"   The interface is explicitly reviewed in this fixture.\n\n","content_start_byte":509,"end_byte":567,"end_line":27,"indent":0,"name":"interface","native_id":"INTERFACE_001","native_version":"1","option_values":{"belongs_to":"COMP_REQ_001","id":"INTERFACE_001","status":"valid","version":"1"},"options":[{"end_byte":446,"line":21,"name":"id","raw":"   :id: INTERFACE_001\n","start_byte":424,"value":"INTERFACE_001"},{"end_byte":464,"line":22,"name":"status","raw":"   :status: valid\n","start_byte":446,"value":"valid"},{"end_byte":479,"line":23,"name":"version","raw":"   :version: 1\n","start_byte":464,"value":"1"},{"end_byte":508,"line":24,"name":"belongs_to","raw":"   :belongs_to: COMP_REQ_001\n","start_byte":479,"value":"COMP_REQ_001"}],"original_digest":"b15575f8e05ab817ee05d9fd63c3e011c93aa84f8a48320346002bea7c7f9e84","path":"index.rst","start_byte":392,"start_line":20,"title":"Stable interface"},{"content":"   Verify deterministic output.\n","content_start_byte":694,"end_byte":726,"end_line":34,"indent":0,"name":"test_case","native_id":"TEST_CASE_001","native_version":"1","option_values":{"fully_verifies":"COMP_REQ_001","id":"TEST_CASE_001","status":"valid","version":"1"},"options":[{"end_byte":627,"line":29,"name":"id","raw":"   :id: TEST_CASE_001\n","start_byte":605,"value":"TEST_CASE_001"},{"end_byte":645,"line":30,"name":"status","raw":"   :status: valid\n","start_byte":627,"value":"valid"},{"end_byte":660,"line":31,"name":"version","raw":"   :version: 1\n","start_byte":645,"value":"1"},{"end_byte":693,"line":32,"name":"fully_verifies","raw":"   :fully_verifies: COMP_REQ_001\n","start_byte":660,"value":"COMP_REQ_001"}],"original_digest":"546a5521d65b4a90974fe5901123a8cea5882bd7cceb3f72062b682f6aa2c188","path":"index.rst","start_byte":567,"start_line":28,"title":"Component verification"}],"newline":"lf","path":"index.rst","sha256":"b61e1d2551795acc10fce2d6b5d4916e995f2716f38cd537618348abc836e3aa"}],"findings":[],"kind":"native_artifact_index","limitations":["Derived index; native RST remains authoritative."],"native_receipt":{"accepted":true,"cleanup":"complete","commands":["fixture-needs-json","fixture-docs-check"],"elapsed_milliseconds":0,"exit_classes":[0,0],"export_digest":"97d6fea80645adb3c62a1a0c1363e5c402856482b0747c21ddef8b145a481e81","limitations":["Fixture-only native adapter; production Bazel validation is not claimed."],"log_digest":"5ac2953530d4a11673ff38f172a068e9fad60e902353db06edca3ed89291fe85","source_set_digest":"fe0068588ccc023fdca8f997205b8392e5bdacc504ec2bd3008d2966cad84478","validator":{"fixture_only":true,"id":"fixture-native-adapter"}},"needs":[{"content":"Updated explicit content.","fingerprint":"c65ca51a0ec6fa2a48ff5b117c55b9b134568b63f4817c173ce950a38696e742","key":"fixture-component:score:COMP_REQ_001@1","native_id":"COMP_REQ_001","native_version":"1","options":{"derived_from":"FEAT_REQ_001","fully_verifies":"TEST_CASE_001","id":"COMP_REQ_001","status":"valid","version":"1"},"origins":[],"relations":[{"allowed_target_types":["feat_req"],"direction":"forward","external":true,"field":"derived_from","raw_selector":"FEAT_REQ_001","source":"fixture-component:score:COMP_REQ_001@1","source_location":{"line":11,"path":"index.rst"},"source_native_id":"COMP_REQ_001","target":null,"target_native_id":"FEAT_REQ_001","target_version":null},{"allowed_target_types":["test_case"],"direction":"forward","external":false,"field":"fully_verifies","raw_selector":"TEST_CASE_001","source":"fixture-component:score:COMP_REQ_001@1","source_location":{"line":11,"path":"index.rst"},"source_native_id":"COMP_REQ_001","target":"fixture-component:score:TEST_CASE_001@1","target_native_id":"TEST_CASE_001","target_version":null}],"source":{"end_line":19,"path":"index.rst","revision":"c4d4ad0000000000000000000000000000000000","start_line":11},"source_id":"score","status":"valid","target_namespace":"fixture-component","title":"Deterministic component","type":"comp_req","wrapper_key":"fixture-component:score:DOC_COMPONENT_001@1"},{"content":"The interface is explicitly reviewed in this fixture.","fingerprint":"c5baddfc2743f61ecda59acbecc672bb743d6ae2e86012d52d95b20caad9fdb5","key":"fixture-component:score:INTERFACE_001@1","native_id":"INTERFACE_001","native_version":"1","options":{"belongs_to":"COMP_REQ_001","id":"INTERFACE_001","status":"valid","version":"1"},"origins":[],"relations":[{"allowed_target_types":["comp_req"],"direction":"forward","external":false,"field":"belongs_to","raw_selector":"COMP_REQ_001","source":"fixture-component:score:INTERFACE_001@1","source_location":{"line":20,"path":"index.rst"},"source_native_id":"INTERFACE_001","target":"fixture-component:score:COMP_REQ_001@1","target_native_id":"COMP_REQ_001","target_version":null}],"source":{"end_line":27,"path":"index.rst","revision":"c4d4ad0000000000000000000000000000000000","start_line":20},"source_id":"score","status":"valid","target_namespace":"fixture-component","title":"Stable interface","type":"interface","wrapper_key":"fixture-component:score:DOC_COMPONENT_001@1"},{"content":"Verify deterministic output.","fingerprint":"5b76e7ec78ec0a9b26394c4dda5604d505ca52e117a3780912e4c5d1ed41a36b","key":"fixture-component:score:TEST_CASE_001@1","native_id":"TEST_CASE_001","native_version":"1","options":{"fully_verifies":"COMP_REQ_001","id":"TEST_CASE_001","status":"valid","version":"1"},"origins":[],"relations":[{"allowed_target_types":["feat_req","comp_req"],"direction":"forward","external":false,"field":"fully_verifies","raw_selector":"COMP_REQ_001","source":"fixture-component:score:TEST_CASE_001@1","source_location":{"line":28,"path":"index.rst"},"source_native_id":"TEST_CASE_001","target":"fixture-component:score:COMP_REQ_001@1","target_native_id":"COMP_REQ_001","target_version":null}],"source":{"end_line":34,"path":"index.rst","revision":"c4d4ad0000000000000000000000000000000000","start_line":28},"source_id":"score","status":"valid","target_namespace":"fixture-component","title":"Component verification","type":"test_case","wrapper_key":"fixture-component:score:DOC_COMPONENT_001@1"}],"profile":{"digest":"01384aaad3bcb3b5f43eb0c5fd72e8ed334271eae52b4da1596c9b8160964dba","id":"s-core-native-artifacts-v1","version":1},"reconciliat